Symbol,Name,Last Sale,Net Change,% Change,Market Cap,Country,IPO Year,Volume,Sector,Industry
MEC,Mayville Engineering Company Inc. Common Stock,$9.24,0.10,1.094%,189722065.00,,2019,46050,Industrials,Metal Fabrications
MEOA,Minority Equality Opportunities Acquisition Inc. Class A Common Stock,$10.05,0.00,0.00%,160504781.00,United States,2021,6,Industrials,Consumer Electronics/Appliances
MEOAU,Minority Equality Opportunities Acquisition Inc. Units,$10.07,0.00,0.00%,0.00,United States,2021,41,Industrials,Consumer Electronics/Appliances
MEOAW,Minority Equality Opportunities Acquisition Inc. Warrants,$0.07,-0.004,-5.405%,0.00,United States,2021,2400,Industrials,Consumer Electronics/Appliances
MIDD,Middleby Corporation (The) Common Stock,$147.11,-2.05,-1.374%,8001288038.00,United States,,288925,Industrials,Diversified Manufacture
MIND,MIND Technology Inc. Common Stock (DE),$1.055,-0.005,-0.472%,14539909.00,United States,1994,29472,Industrials,Industrial Machinery/Components
MINDP,MIND Technology Inc. Series A 9.00% Series A Cumulative Preferred Stock (DE),$14.25,0.1667,1.184%,0.00,United States,,3505,Industrials,Industrial Machinery/Components
MIT,Mason Industrial Technology Inc. Class A Common Stock,$9.76,-0.02,-0.204%,610000000.00,,2021,60885,Industrials,Consumer Electronics/Appliances
MKSI,MKS Instruments Inc. Common Stock,$120.40,-5.06,-4.033%,6701389713.00,United States,1999,569446,Industrials,Industrial Machinery/Components
MLAB,Mesa Laboratories Inc. Common Stock,$211.41,-4.45,-2.062%,1113687162.00,United States,,26416,Industrials,Industrial Machinery/Components
MLAI,McLaren Technology Acquisition Corp. Class A Common Stock,$9.97,-0.02,-0.20%,250807813.00,United States,2021,38363,Industrials,Consumer Electronics/Appliances
MLAIU,McLaren Technology Acquisition Corp. Unit,$10.01,0.00,0.00%,0.00,United States,2021,34946,Industrials,Consumer Electronics/Appliances
MLAIW,McLaren Technology Acquisition Corp. Warrant,$0.10,-0.0186,-15.683%,0.00,United States,2021,10000,Industrials,Consumer Electronics/Appliances
MLI,Mueller Industries Inc. Common Stock,$55.98,0.03,0.054%,3185418184.00,United States,,214223,Industrials,Metal Fabrications
MLM,Martin Marietta Materials Inc. Common Stock,$345.64,-1.69,-0.487%,21527821367.00,United States,1994,270537,Industrials,Building Materials
MMM,3M Company Common Stock,$145.97,-2.21,-1.491%,83065520189.00,United States,,1876404,Industrials,Consumer Electronics/Appliances
MNTN,Everest Consolidator Acquisition Corporation Class A Common Stock,$9.97,0.00,0.00%,214978125.00,,2022,39121,Industrials,Consumer Electronics/Appliances
MON,Monument Circle Acquisition Corp. Class A Common Stock,$9.80,-0.02,-0.204%,306250000.00,United States,2021,1180,Industrials,Consumer Electronics/Appliances
MONCU,Monument Circle Acquisition Corp. Unit,$9.86,-0.01,-0.101%,0.00,United States,2021,511,Industrials,Consumer Electronics/Appliances
MONCW,Monument Circle Acquisition Corp. Warrant,$0.14,0.0043,3.169%,0.00,United States,2021,180503,Industrials,Consumer Electronics/Appliances
MOS,Mosaic Company (The) Common Stock,$59.69,-0.41,-0.682%,21607380793.00,United States,,3522568,Industrials,Agricultural Chemicals
MPRA,Mercato Partners Acquisition Corporation Class A Common Stock,$9.94,0.00,0.00%,285775000.00,United States,2021,6,Industrials,Consumer Electronics/Appliances
MPRAU,Mercato Partners Acquisition Corporation Unit,$9.98,0.00,0.00%,0.00,United States,2021,1,Industrials,Consumer Electronics/Appliances
MPRAW,Mercato Partners Acquisition Corporation Warrant,$0.1689,0.0209,14.122%,0.00,United States,2021,1800,Industrials,Consumer Electronics/Appliances
MRC,MRC Global Inc. Common Stock,$11.57,0.02,0.173%,965903690.00,United States,2012,409347,Industrials,Fluid Controls
MRTN,Marten Transport Ltd. Common Stock,$18.01,0.29,1.637%,1475856393.00,United States,1986,270832,Industrials,Trucking Freight/Courier Services
MSM,MSC Industrial Direct Company Inc. Common Stock,$84.52,-0.54,-0.635%,4719729919.00,United States,1995,253216,Industrials,Industrial Machinery/Components
MT,Arcelor Mittal NY Registry Shares NEW,$32.72,-0.15,-0.456%,28721935740.00,Luxembourg,,2580775,Industrials,Steel/Iron Ore
MTAC,MedTech Acquisition Corporation Class A Common Stock,$9.85,0.00,0.00%,307812500.00,United States,2021,3334,Industrials,Consumer Electronics/Appliances
MTACU,MedTech Acquisition Corporation Unit,$9.90,-0.06,-0.602%,0.00,United States,2020,501,Industrials,Consumer Electronics/Appliances
MTACW,MedTech Acquisition Corporation Warrant,$0.15,-0.0178,-10.608%,0.00,United States,2021,60125,Industrials,Consumer Electronics/Appliances
MTCN,ArcelorMittal 5.50% Mandatorily Convertible Subordinated Notes due 2023,$77.57,-0.01,-0.013%,0.00,Luxembourg,2020,3056,Industrials,Steel/Iron Ore
MTRY,Monterey Bio Acquisition Corporation Common Stock,$10.04,0.00,0.00%,144325000.00,United States,2021,1,Industrials,Consumer Electronics/Appliances
MTRYU,Monterey Bio Acquisition Corporation Unit,$10.07,0.00,0.00%,0.00,United States,2021,1,Industrials,Consumer Electronics/Appliances
MTRYW,Monterey Bio Acquisition Corporation Warrant,$0.09,-0.045,-33.333%,0.00,United States,2021,100,Industrials,Consumer Electronics/Appliances
MTW,Manitowoc Company Inc. (The) Common Stock,$13.39,-0.16,-1.181%,472924155.00,United States,,230272,Industrials,Construction/Ag Equipment/Trucks
MTX,Minerals Technologies Inc. Common Stock,$67.61,-1.29,-1.872%,2228820307.00,United States,1992,94423,Industrials,Major Chemicals
MTZ,MasTec Inc. Common Stock,$81.15,-2.03,-2.44%,6170077382.00,United States,,615619,Industrials,Water Sewer Pipeline Comm & Power Line Construction
MUDS,Mudrick Capital Acquisition Corporation II Class A Common Stock,$10.07,0.01,0.099%,398079688.00,United States,2021,3754,Industrials,Consumer Electronics/Appliances
MUDSU,Mudrick Capital Acquisition Corporation II Unit,$10.33,0.00,0.00%,0.00,United States,2020,46,Industrials,Consumer Electronics/Appliances
MUDSW,Mudrick Capital Acquisition Corporation II Warrant,$0.3732,-0.0168,-4.308%,0.00,United States,2021,3100,Industrials,Consumer Electronics/Appliances
MURF,Murphy Canyon Acquisition Corp. Class A Common Stock,$10.00,0.03,0.301%,172852500.00,United States,2022,4001,Industrials,Consumer Electronics/Appliances
MURFU,Murphy Canyon Acquisition Corp. Unit,$10.10,0.00,0.00%,0.00,United States,2022,1,Industrials,Consumer Electronics/Appliances
MURFW,Murphy Canyon Acquisition Corp. Warrant,$0.1462,-0.0038,-2.533%,0.00,United States,2022,200,Industrials,Consumer Electronics/Appliances
MVIS,MicroVision Inc. Common Stock,$3.83,-0.18,-4.489%,632754193.00,United States,1996,3076114,Industrials,Industrial Machinery/Components
MVST,Microvast Holdings Inc. Common Stock,$5.06,-0.14,-2.692%,1530845518.00,United States,2019,879576,Industrials,Industrial Machinery/Components
MVSTW,Microvast Holdings Inc. Warrants,$0.783,-0.018,-2.247%,0.00,United States,2019,26864,Industrials,Industrial Machinery/Components
MWA,MUELLER WATER PRODUCTS Common Stock,$12.23,-0.11,-0.891%,1920414466.00,United States,2006,608607,Industrials,Office Equipment/Supplies/Services
MYRG,MYR Group Inc. Common Stock,$92.60,-0.77,-0.825%,1574615774.00,United States,2008,78941,Industrials,Water Sewer Pipeline Comm & Power Line Construction
NBST,Newbury Street Acquisition Corporation Common Stock,$9.76,-0.03,-0.306%,162619168.00,United States,2021,346,Industrials,Consumer Electronics/Appliances
NBSTU,Newbury Street Acquisition Corporation Units,$9.825,0.045,0.46%,0.00,United States,2021,711,Industrials,Consumer Electronics/Appliances
NBSTW,Newbury Street Acquisition Corporation Warrants,$0.1301,0.0201,18.273%,0.00,United States,2021,6731,Industrials,Consumer Electronics/Appliances
NDAC,NightDragon Acquisition Corp. Class A Common stock,$9.78,-0.0001,-0.001%,431884800.00,United States,2021,3088,Industrials,Consumer Electronics/Appliances
NDACU,NightDragon Acquisition Corp. SCALE Units,$9.8101,-0.0199,-0.202%,0.00,United States,2021,552,Industrials,Consumer Electronics/Appliances
NDACW,NightDragon Acquisition Corp. Warrants to purchase Class A common stock,$0.30,-0.0009,-0.299%,0.00,United States,2021,5621,Industrials,Consumer Electronics/Appliances
NDSN,Nordson Corporation Common Stock,$220.38,-1.81,-0.815%,12674448280.00,United States,,174628,Industrials,Industrial Machinery/Components
NETC,Nabors Energy Transition Corp. Class A Common Stock,$9.99,0.02,0.201%,344655000.00,,2022,80186,Industrials,Consumer Electronics/Appliances
NEU,NewMarket Corp Common Stock,$328.34,-5.26,-1.577%,3367029183.00,United States,,19829,Industrials,Major Chemicals
NGC,Northern Genesis Acquisition Corp. III Common Stock,$9.75,-0.03,-0.307%,210173438.00,,2021,190,Industrials,Consumer Electronics/Appliances
NGS,Natural Gas Services Group Inc. Common Stock,$14.77,-0.09,-0.606%,184284655.00,United States,2002,21126,Industrials,Metal Fabrications
NGVT,Ingevity Corporation Common Stock ,$72.38,-0.91,-1.242%,2804761624.00,,2016,134684,Industrials,Industrial Specialties
NHIC,NewHold Investment Corp. II Class A Common Stock,$9.79,-0.01,-0.102%,190807100.00,United States,2021,585,Industrials,Consumer Electronics/Appliances
NHICU,NewHold Investment Corp. II Unit,$9.94,0.00,0.00%,0.00,United States,2021,1,Industrials,Consumer Electronics/Appliances
NHICW,NewHold Investment Corp. II Warrant,$0.19,0.01,5.556%,0.00,United States,2021,1200,Industrials,Consumer Electronics/Appliances
NILE,BitNile Holdings Inc. Common Stock,$0.37,-0.04,-9.756%,116078780.00,United States,1997,16134332,Industrials,Military/Government/Technical
NISN,NiSun International Enterprise Development Group Co. Ltd. Class A Common Shares,$0.7596,0.0085,1.132%,13383019.00,China,2016,354130,Industrials,Metal Fabrications
NKLA,Nikola Corporation Common Stock,$6.66,-0.59,-8.138%,2804780951.00,United States,2018,10951933,Industrials,Industrial Machinery/Components
NLIT,Northern Lights Acquisition Corp. Class A Common Stock,$10.1801,0.00,0.00%,151715812.00,United States,2021,119,Industrials,Consumer Electronics/Appliances
NLITU,Northern Lights Acquisition Corp. Units,$10.20,0.00,0.00%,0.00,United States,2021,2081,Industrials,Consumer Electronics/Appliances
NLITW,Northern Lights Acquisition Corp. Warrants,$0.1708,0.0158,10.194%,0.00,United States,2021,10089,Industrials,Consumer Electronics/Appliances
NMMC,North Mountain Merger Corp. Class A Common Stock,$9.90,0.01,0.101%,163659375.00,United States,2020,5201,Industrials,Consumer Electronics/Appliances
NMMCU,North Mountain Merger Corp. Unit,$10.05,0.00,0.00%,0.00,United States,2020,1,Industrials,Consumer Electronics/Appliances
NMMCW,North Mountain Merger Corp. Warrant,$0.3399,0.00,0.00%,0.00,United States,2020,100,Industrials,Consumer Electronics/Appliances
NN,NextNav Inc. Common Stock,$2.99,-0.18,-5.678%,288746184.00,United States,,3037397,Industrials,Industrial Machinery/Components
NNAVW,NextNav Inc. Warrant,$0.47,-0.02,-4.082%,0.00,United States,,50518,Industrials,Industrial Machinery/Components
NNBR,NN Inc. Common Stock,$2.80,0.07,2.564%,122892854.00,United States,1994,204408,Industrials,Consumer Electronics/Appliances
NOAC,Natural Order Acquisition Corp. Common Stock,$9.86,0.00,0.00%,283475000.00,United States,2021,12826,Industrials,Consumer Electronics/Appliances
NOACU,Natural Order Acquisition Corp. Unit,$9.91,-0.02,-0.201%,0.00,United States,2020,42312,Industrials,Consumer Electronics/Appliances
NOACW,Natural Order Acquisition Corp. Warrant,$0.0801,-0.0298,-27.116%,0.00,United States,2021,18315,Industrials,Consumer Electronics/Appliances
NOV,NOV Inc. Common Stock,$21.01,0.83,4.113%,8252675370.00,United States,,3734537,Industrials,Metal Fabrications
NPAB,New Providence Acquisition Corp. II Class A Common Stock,$9.90,0.00,0.00%,309375000.00,United States,2021,47,Industrials,Consumer Electronics/Appliances
NPABU,New Providence Acquisition Corp. II Unit,$9.94,0.00,0.00%,0.00,United States,2021,1,Industrials,Consumer Electronics/Appliances
NPABW,New Providence Acquisition Corp. II Warrant,$0.1611,0.00,0.00%,0.00,United States,2021,237,Industrials,Consumer Electronics/Appliances
NR,Newpark Resources Inc. Common Stock,$4.49,0.11,2.511%,414665437.00,United States,,430195,Industrials,Metal Fabrications
NSC,Norfolk Southern Corporation Common Stock,$244.66,-2.15,-0.871%,58310432875.00,United States,,802957,Industrials,Railroads
NSTB,Northern Star Investment Corp. II Class A Common stock,$9.80,0.00,0.00%,490000000.00,,2021,2428,Industrials,Consumer Electronics/Appliances
NSTC,Northern Star Investment Corp. III Class A Common Stock,$9.80,0.00,0.00%,490000000.00,,2021,96,Industrials,Consumer Electronics/Appliances
NSTD,Northern Star Investment Corp. IV Class A Common Stock,$9.775,0.015,0.154%,488750000.00,,2021,318094,Industrials,Consumer Electronics/Appliances
NTIC,Northern Technologies International Corporation Common Stock,$11.34,0.26,2.347%,104572003.00,United States,,4031,Industrials,Major Chemicals
NTR,Nutrien Ltd. Common Shares,$93.50,-2.38,-2.482%,51546549533.00,,2004,2825555,Industrials,Agricultural Chemicals
NUBI,Nubia Brand International Corp. Class A Common Stock,$9.96,-0.02,-0.20%,155734560.00,United States,2022,25012,Industrials,Consumer Electronics/Appliances
NUBIU,Nubia Brand International Corp. Unit,$10.02,0.02,0.20%,0.00,United States,2022,149556,Industrials,Consumer Electronics/Appliances
NUBIW,Nubia Brand International Corp. Warrant,$0.101,-0.0496,-32.935%,0.00,United States,2022,207,Industrials,Consumer Electronics/Appliances
NUE,Nucor Corporation Common Stock,$128.71,-2.92,-2.218%,34244835386.00,United States,,1587991,Industrials,Steel/Iron Ore
NVAC,NorthView Acquisition Corporation Common Stock,$9.86,0.00,0.00%,238303875.00,United States,2022,101,Industrials,Consumer Electronics/Appliances
NWL,Newell Brands Inc. Common Stock,$21.12,-0.45,-2.086%,8733120000.00,United States,,1695451,Industrials,Plastic Products
NWPX,Northwest Pipe Company Common Stock,$34.10,0.60,1.791%,338134918.00,United States,1995,42852,Industrials,Steel/Iron Ore
NX,Quanex Building Products Corporation Common Stock,$22.91,2.17,10.463%,764905334.00,United States,,263536,Industrials,Metal Fabrications
OB,Outbrain Inc. Common Stock,$5.95,-0.04,-0.668%,343490281.00,United States,2021,243075,Industrials,Industrial Machinery/Components
OBCI,Ocean Bio-Chem Inc. Common Stock,$6.80,0.00,0.00%,64666633.00,United States,,16779,Industrials,Consumer Electronics/Appliances
OCAX,OCA Acquisition Corp. Class A Common Stock,$10.01,-0.03,-0.299%,187061875.00,United States,2021,20858,Industrials,Consumer Electronics/Appliances
OCAXW,OCA Acquisition Corp. Warrant,$0.059,-0.001,-1.667%,0.00,United States,2021,300,Industrials,Consumer Electronics/Appliances
OCC,Optical Cable Corporation Common Stock,$3.86,0.16,4.324%,30300992.00,United States,,2293,Industrials,Telecommunications Equipment
ODC,Oil-Dri Corporation Of America Common Stock,$24.77,0.87,3.64%,181624242.00,United States,,38648,Industrials,Industrial Specialties
ODFL,Old Dominion Freight Line Inc. Common Stock,$268.19,0.71,0.265%,30400344894.00,United States,1991,809349,Industrials,Trucking Freight/Courier Services
OEC,Orion Engineered Carbons S.A Common Shares,$20.32,0.27,1.347%,1229098217.00,Luxembourg,2014,698688,Industrials,Specialty Chemicals
OEPW,One Equity Partners Open Water I Corp. Class A Common Stock,$9.79,-0.01,-0.102%,422193750.00,United States,2021,4190,Industrials,Consumer Electronics/Appliances
OEPWU,One Equity Partners Open Water I Corp. Unit,$9.82,0.00,0.00%,0.00,United States,2021,3200,Industrials,Consumer Electronics/Appliances
OEPWW,One Equity Partners Open Water I Corp. Warrant,$0.1665,-0.002,-1.187%,0.00,United States,2021,2200,Industrials,Consumer Electronics/Appliances
OFLX,Omega Flex Inc. Common Stock,$111.25,-4.00,-3.471%,1122993323.00,United States,,5076,Industrials,Building Products
OHAAW,OPY Acquisition Corp. I Warrant,$0.2999,-0.0731,-19.598%,0.00,United States,2021,7420,Industrials,Consumer Electronics/Appliances
OHPA,Orion Acquisition Corp. Class A common stock,$9.80,0.02,0.204%,507150000.00,United States,2021,510,Industrials,Consumer Electronics/Appliances
OHPAU,Orion Acquisition Corp. Unit,$9.84,0.06,0.613%,0.00,United States,2021,102,Industrials,Consumer Electronics/Appliances
OHPAW,Orion Acquisition Corp. Warrant,$0.11,0.00,0.00%,0.00,United States,2021,2,Industrials,Consumer Electronics/Appliances
OIS,Oil States International Inc. Common Stock,$7.99,0.07,0.884%,494508970.00,United States,2001,577952,Industrials,Metal Fabrications
OLIT,OmniLit Acquisition Corp. Class A Common Stock,$10.00,0.01,0.10%,191666670.00,United States,2022,2948,Industrials,Consumer Electronics/Appliances
OLITW,OmniLit Acquisition Corp. Warrants.,$0.155,-0.0075,-4.615%,0.00,United States,2022,78806,Industrials,Consumer Electronics/Appliances
OLK,Olink Holding AB (publ) American Depositary Shares,$12.40,-0.42,-3.276%,1476816663.00,Sweden,2021,126066,Industrials,Biotechnology: Laboratory Analytical Instruments
OLN,Olin Corporation Common Stock,$65.70,-1.22,-1.823%,9975397090.00,United States,,1100174,Industrials,Industrial Specialties
OPTT,Ocean Power Technologies Inc. Common Stock,$0.8891,0.0456,5.406%,49695545.00,United States,2007,382802,Industrials,Industrial Machinery/Components
ORGN,Origin Materials Inc. Common Stock,$6.97,-0.73,-9.481%,985789279.00,United States,2020,2092893,Industrials,Industrial Specialties
ORN,Orion Group Holdings Inc. Common,$2.66,-0.16,-5.674%,81505318.00,United States,,24009,Industrials,Oilfield Services/Equipment
OSI,Osiris Acquisition Corp. Class A Common Stock,$9.73,0.00,0.00%,279737500.00,,2021,88,Industrials,Consumer Electronics/Appliances
OSTR,Oyster Enterprises Acquisition Corp. Class A Common Stock,$9.81,0.00,0.00%,282037500.00,United States,2021,2757,Industrials,Consumer Electronics/Appliances
OSTRU,Oyster Enterprises Acquisition Corp. Unit,$9.885,-0.005,-0.051%,0.00,United States,2021,1200,Industrials,Consumer Electronics/Appliances
OSTRW,Oyster Enterprises Acquisition Corp. Warrant,$0.1999,0.0101,5.321%,0.00,United States,2021,1190,Industrials,Consumer Electronics/Appliances
OTEC,OceanTech Acquisitions I Corp. Class A Common Stock,$10.08,0.00,0.00%,131148461.00,United States,2021,299,Industrials,Consumer Electronics/Appliances
OTECU,OceanTech Acquisitions I Corp. Units,$10.326,0.281,2.797%,0.00,United States,2021,780,Industrials,Consumer Electronics/Appliances
PACI,PROOF Acquisition Corp I Class A Common Stock,$9.89,-0.03,-0.302%,341205000.00,,2022,175156,Industrials,Consumer Electronics/Appliances
PACK,Ranpak Holdings Corp Class A Common Stock,$12.68,-0.39,-2.984%,1038896834.00,,2018,615101,Industrials,Containers/Packaging
PAFO,Pacifico Acquisition Corp. Common Stock,$10.00,0.00,0.00%,74950000.00,United States,2021,11,Industrials,Consumer Electronics/Appliances
PATI,Patriot Transportation Holding Inc. Common Stock,$7.46,0.02,0.269%,25967663.00,United States,,7198,Industrials,Trucking Freight/Courier Services
PBAXW,Phoenix Biotech Acquisition Corp. Warrants,$0.13,0.0001,0.077%,0.00,United States,2021,50000,Industrials,Consumer Electronics/Appliances
PCAR,PACCAR Inc. Common Stock,$88.29,-0.66,-0.742%,30696951670.00,United States,,1903297,Industrials,Construction/Ag Equipment/Trucks
PCPC,Periphas Capital Partnering Corporation Class A Common Stock,$24.505,0.00,0.00%,435051968.00,,2021,1,Industrials,Consumer Electronics/Appliances
PCX,Parsec Capital Acquisitions Corp Class A Common Stock,$10.03,0.00,0.00%,108135938.00,United States,2021,51058,Industrials,Consumer Electronics/Appliances
PFHC,ProFrac Holding Corp. Class A Common Stock,$19.60,1.10,5.946%,764573460.00,United States,2022,431148,Industrials,Metal Fabrications
PFIN,P & F Industries Inc. Class A Common Stock,$5.755,0.00,0.00%,18308301.00,United States,,78,Industrials,Industrial Machinery/Components
PGRW,Progress Acquisition Corp. Class A Common Stock,$9.87,0.00,0.00%,214302375.00,United States,2021,142,Industrials,Consumer Electronics/Appliances
PGRWW,Progress Acquisition Corp. Warrant,$0.1141,0.0041,3.727%,0.00,United States,2021,600,Industrials,Consumer Electronics/Appliances
PGTI,PGT Innovations Inc.,$20.24,-0.19,-0.93%,1212751452.00,United States,2006,173555,Industrials,Building Products
PH,Parker-Hannifin Corporation Common Stock,$276.84,-1.98,-0.71%,35538506695.00,United States,,340713,Industrials,Office Equipment/Supplies/Services
PICC,Pivotal Investment Corporation III Class A Common Stock,$9.78,-0.03,-0.306%,337410000.00,,2021,100,Industrials,Consumer Electronics/Appliances
PIPP,Pine Island Acquisition Corp. Class A Common Stock,$9.86,-0.01,-0.101%,269163210.00,United States,2021,9777,Industrials,Consumer Electronics/Appliances
PKOH,Park-Ohio Holdings Corp. Common Stock,$16.04,0.00,0.00%,201766374.00,United States,,47212,Industrials,Office Equipment/Supplies/Services
PKX,POSCO Holdings Inc. American Depositary Shares (Each representing 1/4th of a share of Common Stock),$57.10,-1.21,-2.075%,18004621028.00,South Korea,1994,89662,Industrials,Steel/Iron Ore
PL,Planet Labs PBC Class A Common Stock,$5.83,-0.28,-4.583%,1561834059.00,,2021,2470603,Industrials,Aerospace
PLOW,Douglas Dynamics Inc. Common Stock,$31.24,-0.75,-2.344%,714983413.00,United States,2010,67055,Industrials,Construction/Ag Equipment/Trucks
PLPC,Preformed Line Products Company Common Stock,$62.70,-1.56,-2.428%,309743894.00,United States,,25730,Industrials,Telecommunications Equipment
PMGM,Priveterra Acquisition Corp. Class A Common Stock,$9.80,0.01,0.102%,338100000.00,United States,2021,384,Industrials,Consumer Electronics/Appliances
PMGMU,Priveterra Acquisition Corp. Units,$9.82,0.00,0.00%,0.00,United States,2021,2,Industrials,Consumer Electronics/Appliances
PMGMW,Priveterra Acquisition Corp. Warrant,$0.18,0.0018,1.01%,0.00,United States,2021,50000,Industrials,Consumer Electronics/Appliances
PMVC,PMV Consumer Acquisition Corp. Class A Common Stock,$9.93,0.01,0.101%,217218750.00,United States,2020,1574,Industrials,Consumer Electronics/Appliances
PNACU,Prime Number Acquisition I Corp. Unit,$10.00,0.00,0.00%,0.00,United States,2022,101,Industrials,Consumer Electronics/Appliances
PNR,Pentair plc. Ordinary Share,$50.80,-0.55,-1.071%,8402303439.00,Switzerland,,826688,Industrials,Fluid Controls
POLA,Polar Power Inc. Common Stock,$3.01,0.00,0.00%,38492491.00,United States,2016,52043,Industrials,Industrial Machinery/Components
PONO,Pono Capital Corp Class A Common Stock,$10.16,0.05,0.495%,151350218.00,United States,2021,52200,Industrials,Consumer Electronics/Appliances
PORT,Southport Acquisition Corporation Class A Common Stock,$9.91,-0.01,-0.101%,284912500.00,,2022,1200,Industrials,Consumer Electronics/Appliances
POWW,AMMO Inc. Common Stock,$4.28,-0.11,-2.506%,494453009.00,United States,,582593,Industrials,Military/Government/Technical
POWWP,AMMO Inc. 8.75% Series A Cumulative Redeemable Perpetual Preferred Stock,$26.40,-0.20,-0.752%,0.00,United States,,3871,Industrials,Military/Government/Technical
PPHP,PHP Ventures Acquisition Corp. Class A Common Stock,$10.02,0.00,0.00%,74958618.00,Malaysia,2021,998,Industrials,Consumer Electronics/Appliances
PPHPU,PHP Ventures Acquisition Corp. Units,$10.16,0.00,0.00%,0.00,Malaysia,2021,1980,Industrials,Consumer Electronics/Appliances
PPHPW,PHP Ventures Acquisition Corp. Warrants,$0.0759,0.0209,38.00%,0.00,Malaysia,2021,3302,Industrials,Consumer Electronics/Appliances
PPSI,Pioneer Power Solutions Inc. Common Stock,$4.44,-0.03,-0.671%,42821780.00,United States,,161735,Industrials,Electrical Products
PPYA,Papaya Growth Opportunity Corp. I Class A Common Stock,$9.94,0.00,0.00%,374185088.00,United States,2022,65,Industrials,Consumer Electronics/Appliances
PPYAW,Papaya Growth Opportunity Corp. I Warrant,$0.216,0.046,27.059%,0.00,United States,2022,21230,Industrials,Consumer Electronics/Appliances
PRBM,Parabellum Acquisition Corp. Class A Common Stock,$9.85,0.02,0.203%,176992188.00,,2021,7716,Industrials,Consumer Electronics/Appliances
PRIM,Primoris Services Corporation Common Stock,$24.63,-0.22,-0.885%,1313530141.00,United States,,226995,Industrials,Water Sewer Pipeline Comm & Power Line Construction
PRLB,Proto Labs Inc. Common stock,$48.75,-0.71,-1.436%,1340436923.00,United States,2012,98508,Industrials,Office Equipment/Supplies/Services
PRPO,Precipio Inc.  Common Stock,$1.18,-0.03,-2.479%,26796275.00,United States,,26001,Industrials,Biotechnology: Laboratory Analytical Instruments
PSAG,Property Solutions Acquisition Corporation II Class A Common Stock,$9.76,-0.01,-0.102%,397856640.00,United States,2021,1494,Industrials,Consumer Electronics/Appliances
PSAGU,Property Solutions Acquisition Corporation II Units,$9.79,0.00,0.00%,0.00,United States,2021,1281,Industrials,Consumer Electronics/Appliances
PSAGW,Property Solutions Acquisition Corporation II Warrant,$0.1454,-0.0496,-25.436%,0.00,United States,2021,1001,Industrials,Consumer Electronics/Appliances
PSN,Parsons Corporation Common Stock,$40.55,0.14,0.346%,4206256934.00,,2019,333787,Industrials,Industrial Machinery/Components
PSPC,Post Holdings Partnering Corporation Series A Common Stock,$9.68,0.00,0.00%,428001200.00,,2021,102,Industrials,Consumer Electronics/Appliances
PSTH,Pershing Square Tontine Holdings Ltd. Class A Common Stock,$19.92,0.02,0.101%,3984001992.00,,2020,514507,Industrials,Consumer Electronics/Appliances
PTIC,PropTech Investment Corporation II Class A Common Stock,$9.84,-0.01,-0.102%,282900000.00,United States,2021,10100,Industrials,Consumer Electronics/Appliances
PTICW,PropTech Investment Corporation II Warrant,$0.27,-0.0003,-0.111%,0.00,United States,2021,818,Industrials,Consumer Electronics/Appliances
PTOC,Pine Technology Acquisition Corp. Class A Common Stock,$9.76,0.00,0.00%,420900000.00,United States,2021,174,Industrials,Consumer Electronics/Appliances
PTOCW,Pine Technology Acquisition Corp. Warrant,$0.11,0.00,0.00%,0.00,United States,2021,14113,Industrials,Consumer Electronics/Appliances
