Symbol,Name,Last Sale,Net Change,% Change,Market Cap,Country,IPO Year,Volume,Sector,Industry
MULN,Mullen Automotive Inc. Common Stock,$1.27,0.04,3.252%,422203099.00,United States,,95589622,Consumer Discretionary,Auto Manufacturing
MYE,Myers Industries Inc. Common Stock,$25.08,-0.04,-0.159%,911504335.00,United States,1983,81736,Consumer Discretionary,Auto Parts:O.E.M.
MYMD,MyMD Pharmaceuticals Inc. Common Stock,$3.01,-0.10,-3.215%,114555317.00,United States,2014,40536,Consumer Discretionary,Specialty Chemicals
MYTE,MYT Netherlands Parent B.V. American Depositary Shares each representing one Ordinary Share,$11.62,-0.09,-0.769%,981794879.00,,2021,20223,Consumer Discretionary,Catalog/Specialty Distribution
NAII,Natural Alternatives International Inc. Common Stock,$10.50,0.069,0.661%,64579746.00,United States,,2347,Consumer Discretionary,Food Distributors
NAT,Nordic American Tankers Limited Common Stock,$2.18,0.14,6.863%,439646839.00,Bermuda,1995,6181955,Consumer Discretionary,Marine Transportation
NATH,Nathan's Famous Inc. Common Stock,$50.90,-0.09,-0.177%,209461339.00,United States,1993,8469,Consumer Discretionary,Restaurants
NCLH,Norwegian Cruise Line Holdings Ltd. Ordinary Shares,$15.63,-0.45,-2.799%,6550550459.00,United States,,14897268,Consumer Discretionary,Marine Transportation
NCMI,National CineMedia Inc. Common Stock,$1.21,-0.02,-1.626%,98922801.00,United States,2007,1470288,Consumer Discretionary,Advertising
NDLS,Noodles & Company Class A Common Stock,$6.05,-0.05,-0.82%,277300074.00,United States,2013,241397,Consumer Discretionary,Restaurants
NETI,Eneti Inc. Common Stock,$6.92,0.04,0.581%,281911832.00,Monaco,2013,217317,Consumer Discretionary,Marine Transportation
NFLX,Netflix Inc. Common Stock,$198.98,-6.11,-2.979%,88401610673.00,United States,2002,7191775,Consumer Discretionary,Movies/Entertainment
NGMS,NeoGames S.A. Ordinary Shares,$13.62,-0.69,-4.822%,352208624.00,Israel,2020,129965,Consumer Discretionary,Services-Misc. Amusement & Recreation
NIO,NIO Inc. American depositary shares each  representing one Class A ordinary share,$18.08,-0.77,-4.085%,30203248121.00,,2018,57620710,Consumer Discretionary,Auto Manufacturing
NIU,Niu Technologies American Depositary Shares,$7.51,-0.30,-3.841%,577697265.00,China,2018,154540,Consumer Discretionary,Auto Manufacturing
NKE,Nike Inc. Common Stock,$120.95,-2.46,-1.993%,190347175376.00,United States,,5201515,Consumer Discretionary,Shoe Manufacturing
NL,NL Industries Inc. Common Stock,$8.94,0.09,1.017%,436296442.00,United States,,30991,Consumer Discretionary,Diversified Commercial Services
NLS,Nautilus Inc. Common Stock,$2.14,0.02,0.943%,66871358.00,United States,,925442,Consumer Discretionary,Recreational Games/Products/Toys
NLSN,Nielsen N.V. Ordinary Shares,$25.37,-0.30,-1.169%,9125419072.00,Netherlands,2011,1986181,Consumer Discretionary,Business Services
NM,Navios Maritime Holdings Inc. Common Stock,$3.37,0.08,2.432%,76917985.00,Monaco,,114983,Consumer Discretionary,Marine Transportation
NMM,Navios Maritime Partners LP Common Units Representing Limited Partner Interests,$31.22,0.06,0.193%,942753056.00,Greece,2007,64109,Consumer Discretionary,Marine Transportation
NPK,National Presto Industries Inc. Common Stock,$69.14,0.18,0.261%,487694616.00,United States,,31036,Consumer Discretionary,Military/Government/Technical
NSP,Insperity Inc. Common Stock,$99.11,-2.61,-2.566%,3796703303.00,United States,,192659,Consumer Discretionary,Diversified Commercial Services
NTCO,Natura &Co Holding S.A. American Depositary Shares ,$7.35,0.13,1.801%,5056975489.00,,2020,1204066,Consumer Discretionary,Package Goods/Cosmetics
NTES,NetEase Inc. American Depositary Shares,$102.39,-1.97,-1.888%,67249562988.00,China,,1009228,Consumer Discretionary,Recreational Games/Products/Toys
NTZ,Natuzzi S.p.A.,$9.50,0.05,0.529%,104220786.00,Italy,1993,6910,Consumer Discretionary,Home Furnishings
NVCT,Nuvectis Pharma Inc. Common Stock,$12.15,-0.87,-6.682%,154521197.00,United States,2022,39542,Consumer Discretionary,Specialty Chemicals
NVEE,NV5 Global Inc. Common Stock,$123.11,-1.26,-1.013%,1907644973.00,United States,2013,40867,Consumer Discretionary,Military/Government/Technical
NVFY,Nova Lifestyle Inc. Common Stock,$0.7544,-0.0598,-7.345%,5158479.00,United States,,25465,Consumer Discretionary,Home Furnishings
NVGS,Navigator Holdings Ltd. Ordinary Shares (Marshall Islands),$14.37,-0.68,-4.518%,1110181854.00,Isle of Man,2013,229049,Consumer Discretionary,Marine Transportation
NVR,NVR Inc. Common Stock,$4428.00,-34.76,-0.779%,14566641048.00,United States,1998,14119,Consumer Discretionary,Homebuilding
NWS,News Corporation Class B Common Stock,$17.47,-0.55,-3.052%,10232905542.00,United States,,392959,Consumer Discretionary,Movies/Entertainment
NWSA,News Corporation Class A Common Stock,$17.20,-0.51,-2.88%,10074755314.00,United States,,1895241,Consumer Discretionary,Movies/Entertainment
NXST,Nexstar Media Group Inc. Class A Common Stock,$175.81,-0.27,-0.153%,7103471544.00,United States,2003,340078,Consumer Discretionary,Movies/Entertainment
NYT,New York Times Company (The) Common Stock,$34.26,-0.43,-1.24%,5737909064.00,United States,,693976,Consumer Discretionary,Newspapers/Magazines
OCG,Oriental Culture Holding LTD Ordinary Shares,$3.41,-0.04,-1.159%,71762468.00,China,2020,112320,Consumer Discretionary,Other Consumer Services
OESX,Orion Energy Systems Inc. Common Stock,$2.33,0.02,0.866%,72445369.00,United States,2015,38803,Consumer Discretionary,Building Products
OG,Onion Global Limited American Depositary Shares (each ten (10) ADSs representing one (1) Class A Ordinary Share),$1.03,-0.06,-5.505%,91926274.00,,2021,5167,Consumer Discretionary,Catalog/Specialty Distribution
OI,O-I Glass Inc. Common Stock,$17.00,0.32,1.918%,2655670793.00,United States,,1097189,Consumer Discretionary,Containers/Packaging
OLLI,Ollie's Bargain Outlet Holdings Inc. Common Stock,$47.39,0.37,0.787%,2972820953.00,United States,2015,1185707,Consumer Discretionary,Department/Specialty Retail Stores
OMAB,Grupo Aeroportuario del Centro Norte S.A.B. de C.V. ADS,$58.64,1.08,1.876%,2830621878.00,Mexico,2006,33848,Consumer Discretionary,Aerospace
OMC,Omnicom Group Inc. Common Stock,$71.63,-1.63,-2.225%,14736632155.00,United States,,1349078,Consumer Discretionary,Advertising
OMEX,Odyssey Marine Exploration Inc. Common Stock,$3.96,0.09,2.326%,57369098.00,United States,,110716,Consumer Discretionary,Marine Transportation
ONCR,Oncorus Inc. Common Stock,$1.13,0.06,5.607%,29248946.00,United States,2020,116501,Consumer Discretionary,Specialty Chemicals
ONEW,OneWater Marine Inc. Class A Common Stock,$34.38,-1.30,-3.643%,485897009.00,United States,2020,46644,Consumer Discretionary,Homebuilding
OOMA,Ooma Inc. Common Stock,$13.76,-0.40,-2.825%,333911760.00,,2015,94177,Consumer Discretionary,Telecommunications Equipment
ORLY,O'Reilly Automotive Inc. Common Stock,$631.61,-2.51,-0.396%,41512841369.00,United States,1993,350812,Consumer Discretionary,Auto & Home Supply Stores
OSK,Oshkosh Corporation (Holding Company)Common Stock,$94.39,-0.32,-0.338%,6210382782.00,United States,,371897,Consumer Discretionary,Auto Manufacturing
OSTK,Overstock.com Inc. Common Stock,$30.85,-1.77,-5.426%,1317918139.00,United States,2002,1084123,Consumer Discretionary,Catalog/Specialty Distribution
OSW,OneSpaWorld Holdings Limited Common Shares,$9.58,0.09,0.948%,882614511.00,Bahamas,,228561,Consumer Discretionary,Hotels/Resorts
OXM,Oxford Industries Inc. Common Stock,$94.51,0.46,0.489%,1544799785.00,United States,,125079,Consumer Discretionary,Apparel
PAG,Penske Automotive Group Inc. Common Stock,$117.20,0.29,0.248%,8894439264.00,United States,,301217,Consumer Discretionary,Other Specialty Stores
PANL,Pangaea Logistics Solutions Ltd. Common Shares,$6.90,0.15,2.222%,317442656.00,United States,2013,471608,Consumer Discretionary,Marine Transportation
PARA,Paramount Global Class B Common Stock,$30.80,-0.63,-2.004%,19992295954.00,United States,,8669759,Consumer Discretionary,Movies/Entertainment
PARAA,Paramount Global Class A Common Stock,$33.17,-0.52,-1.543%,21530664182.00,United States,,38224,Consumer Discretionary,Movies/Entertainment
PARAP,Paramount Global 5.75% Series A Mandatory Convertible Preferred Stock,$47.19,-0.51,-1.069%,0.00,United States,,21011,Consumer Discretionary,Movies/Entertainment
PATK,Patrick Industries Inc. Common Stock,$58.87,-1.93,-3.174%,1354290810.00,United States,,126949,Consumer Discretionary,Other Specialty Stores
PAYX,Paychex Inc. Common Stock,$125.81,-0.14,-0.111%,45419597710.00,United States,1983,1355399,Consumer Discretionary,Business Services
PBI,Pitney Bowes Inc. Common Stock,$4.86,-0.08,-1.619%,842880147.00,United States,,1517477,Consumer Discretionary,Oil Refining/Marketing
PBPB,Potbelly Corporation Common Stock,$5.64,-0.03,-0.529%,162761489.00,United States,2013,8913,Consumer Discretionary,Restaurants
PDD,Pinduoduo Inc. American Depositary Shares,$50.90,-1.77,-3.361%,64357230552.00,China,2018,7720765,Consumer Discretionary,Catalog/Specialty Distribution
PENN,Penn National Gaming Inc. Common Stock,$32.91,-0.77,-2.286%,5489480345.00,United States,1994,2743422,Consumer Discretionary,Movies/Entertainment
PFGC,Performance Food Group Company Common Stock,$42.65,-0.50,-1.159%,6610832741.00,United States,2015,1467580,Consumer Discretionary,Food Distributors
PFSW,PFSweb Inc. Common Stock,$12.95,0.07,0.543%,290765897.00,United States,1999,81165,Consumer Discretionary,Business Services
PG,Procter & Gamble Company (The) Common Stock,$145.89,-1.32,-0.897%,350033416133.00,United States,,4720680,Consumer Discretionary,Package Goods/Cosmetics
PII,Polaris Inc. Common Stock,$100.00,-6.75,-6.323%,5949725900.00,United States,,767974,Consumer Discretionary,Recreational Games/Products/Toys
PIK,Kidpik Corp. Common Stock,$1.89,-0.01,-0.526%,14543287.00,United States,2021,327832,Consumer Discretionary,Department/Specialty Retail Stores
PIXY,ShiftPixy Inc. Common Stock,$0.3143,-0.0071,-2.209%,10579826.00,United States,2017,1530953,Consumer Discretionary,Diversified Commercial Services
PLAY,Dave & Buster's Entertainment Inc. Common Stock,$35.59,-2.46,-6.465%,1731794381.00,United States,2014,1773501,Consumer Discretionary,Movies/Entertainment
PLBY,PLBY Group Inc. Common Stock,$8.61,-0.26,-2.931%,392482269.00,United States,2020,711231,Consumer Discretionary,Recreational Games/Products/Toys
PLCE,Children's Place Inc. (The) Common Stock,$45.31,-1.03,-2.223%,596907325.00,United States,1997,307546,Consumer Discretionary,Clothing/Shoe/Accessory Stores
PLNT,Planet Fitness Inc. Common Stock,$71.32,-0.52,-0.724%,6056905417.00,United States,2015,601979,Consumer Discretionary,Other Consumer Services
PLRX,Pliant Therapeutics Inc. Common Stock,$6.47,0.46,7.654%,234016458.00,United States,2020,230193,Consumer Discretionary,Specialty Chemicals
PLUG,Plug Power Inc. Common Stock,$17.90,-0.39,-2.132%,10348017996.00,United States,1999,14501079,Consumer Discretionary,Electrical Products
PLYA,Playa Hotels & Resorts N.V. Ordinary Shares,$9.18,-0.05,-0.542%,1521842655.00,Netherlands,,1718363,Consumer Discretionary,Hotels/Resorts
PM,Philip Morris International Inc Common Stock,$105.52,-0.69,-0.65%,163567640544.00,United States,,5991709,Consumer Discretionary,Farming/Seeds/Milling
PMVP,PMV Pharmaceuticals Inc. Common Stock,$13.85,0.29,2.139%,631200939.00,United States,2020,1907024,Consumer Discretionary,Specialty Chemicals
PNT,POINT Biopharma Global Inc. Common Stock,$8.12,-0.19,-2.286%,731809178.00,United States,2020,460610,Consumer Discretionary,Specialty Chemicals
POOL,Pool Corporation Common Stock,$407.27,-7.24,-1.747%,16300950390.00,United States,1995,331339,Consumer Discretionary,Recreational Games/Products/Toys
POSH,Poshmark Inc. Class A Common Stock,$11.12,-0.32,-2.797%,868736167.00,United States,2021,767851,Consumer Discretionary,Department/Specialty Retail Stores
POST,Post Holdings Inc. Common Stock,$80.54,-0.66,-0.813%,4892376447.00,United States,2012,208708,Consumer Discretionary,Food Distributors
PPG,PPG Industries Inc. Common Stock,$125.46,-3.33,-2.586%,29632942775.00,United States,,813543,Consumer Discretionary,Paints/Coatings
PRDO,Perdoceo Education Corporation Common Stock,$10.77,-0.11,-1.011%,740752964.00,United States,,531385,Consumer Discretionary,Other Consumer Services
PRDS,Pardes Biosciences Inc. Common Stock,$5.46,-0.19,-3.363%,340272245.00,United States,2021,101349,Consumer Discretionary,Specialty Chemicals
PRG,PROG Holdings Inc. Common Stock,$26.34,-1.15,-4.183%,1423498283.00,United States,,465019,Consumer Discretionary,Diversified Commercial Services
PRLD,Prelude Therapeutics Incorporated Common Stock,$4.75,0.12,2.592%,226554285.00,United States,2020,157361,Consumer Discretionary,Specialty Chemicals
PRPL,Purple Innovation Inc. Common Stock,$4.68,-0.13,-2.703%,386781764.00,United States,2015,1201723,Consumer Discretionary,Home Furnishings
PRTS,CarParts.com Inc. Common Stock,$7.76,-0.38,-4.668%,419476003.00,United States,2007,664860,Consumer Discretionary,Auto & Home Supply Stores
PSFE,Paysafe Limited Common Shares,$2.70,-0.15,-5.263%,1957852947.00,,2021,3904931,Consumer Discretionary,Business Services
PSHG,Performance Shipping Inc. Common Shares,$0.67,-0.0098,-1.442%,1859270.00,Greece,,1167995,Consumer Discretionary,Marine Transportation
PSMT,PriceSmart Inc. Common Stock,$78.23,-0.98,-1.237%,2415268170.00,United States,,69920,Consumer Discretionary,Department/Specialty Retail Stores
PSO,Pearson Plc Common Stock,$9.47,-0.14,-1.457%,7039950072.00,United Kingdom,,258884,Consumer Discretionary,Books
PSTX,Poseida Therapeutics Inc. Common Stock,$2.11,0.05,2.427%,132306972.00,United States,2020,177647,Consumer Discretionary,Specialty Chemicals
PTE,PolarityTE Inc. Common Stock,$2.40,0.06,2.564%,9600571.00,United States,,151225,Consumer Discretionary,Specialty Chemicals
PTLO,Portillo's Inc. Class A Common Stock,$17.76,-0.24,-1.333%,636645757.00,United States,2021,307614,Consumer Discretionary,Restaurants
PTON,Peloton Interactive Inc. Class A Common Stock,$12.53,-0.64,-4.86%,4227080478.00,United States,2019,8510214,Consumer Discretionary,Other Consumer Services
PTRA,Proterra Inc. Common Stock,$6.47,-0.35,-5.132%,1442810000.00,United States,2020,1820629,Consumer Discretionary,Auto Manufacturing
PTVE,Pactiv Evergreen Inc. Common stock,$10.54,0.08,0.765%,1872624957.00,United States,2020,475257,Consumer Discretionary,Containers/Packaging
PXS,Pyxis Tankers Inc. Common Stock,$2.65,-0.02,-0.749%,57133695.00,Greece,,40076,Consumer Discretionary,Marine Transportation
PXSAP,Pyxis Tankers Inc. 7.75% Series A Cumulative Convertible Preferred Shares,$19.4397,0.4398,2.315%,0.00,Greece,,1477,Consumer Discretionary,Marine Transportation
PXSAW,Pyxis Tankers Inc. Warrant,$0.29,-0.0088,-2.945%,0.00,Greece,,785,Consumer Discretionary,Marine Transportation
PYPL,PayPal Holdings Inc. Common Stock,$86.53,-1.79,-2.027%,100205195056.00,United States,,11808262,Consumer Discretionary,Business Services
PZZA,Papa John's International Inc. Common Stock,$87.83,-3.07,-3.377%,3143866594.00,United States,1993,531639,Consumer Discretionary,Restaurants
QH,Quhuo Limited American Depository Shares,$0.3575,0.00,0.00%,15832452.00,China,2020,27906,Consumer Discretionary,Business Services
QNST,QuinStreet Inc. Common Stock,$10.87,-0.17,-1.54%,595752949.00,United States,2010,220433,Consumer Discretionary,Advertising
QRHC,Quest Resource Holding Corporation Common Stock,$4.39,-0.01,-0.227%,83689678.00,United States,,45652,Consumer Discretionary,Diversified Commercial Services
QRTEA,Qurate Retail Inc. Series A Common Stock ,$3.67,-0.12,-3.166%,1401975159.00,United States,,4815186,Consumer Discretionary,Catalog/Specialty Distribution
QRTEB,Qurate Retail Inc. Series B Common Stock ,$5.08,0.659,14.906%,1940608666.00,United States,,18200,Consumer Discretionary,Catalog/Specialty Distribution
QRTEP,Qurate Retail Inc. 8.0% Fixed Rate Cumulative Redeemable Preferred Stock,$65.80,-1.49,-2.214%,0.00,United States,,35159,Consumer Discretionary,Catalog/Specialty Distribution
QS,QuantumScape Corporation Class A Common Stock,$11.76,-0.48,-3.922%,5062038080.00,United States,2020,5858488,Consumer Discretionary,Auto Parts:O.E.M.
QTEK,QualTek Services Inc. Class A Common Stock,$1.67,0.005,0.30%,40825294.00,United States,2021,36569,Consumer Discretionary,Telecommunications Equipment
QTEKW,QualTek Services Inc. Warrant,$0.2201,-0.0101,-4.387%,0.00,United States,2021,83881,Consumer Discretionary,Telecommunications Equipment
QUAD,Quad Graphics Inc Class A Common Stock,$3.82,-0.29,-7.056%,212317063.00,United States,,404907,Consumer Discretionary,Recreational Games/Products/Toys
QUOT,Quotient Technology Inc. Common Stock,$4.12,-0.18,-4.186%,392298144.00,,2014,876424,Consumer Discretionary,Advertising
R,Ryder System Inc. Common Stock,$81.60,1.16,1.442%,4172753088.00,United States,,508206,Consumer Discretionary,Rental/Leasing Companies
RACE,Ferrari N.V. Common Shares,$189.71,-8.17,-4.129%,34690064977.00,,2015,535700,Consumer Discretionary,Auto Manufacturing
RADI,Radius Global Infrastructure Inc. Class A Common Stock,$15.45,0.05,0.325%,1432727801.00,United States,,977112,Consumer Discretionary,Telecommunications Equipment
RANI,Rani Therapeutics Holdings Inc. Class A Common Stock,$10.50,-0.02,-0.19%,257130647.00,United States,2021,18420,Consumer Discretionary,Specialty Chemicals
RAVE,Rave Restaurant Group Inc. Common Stock,$0.9494,0.0194,2.086%,17093856.00,United States,,50220,Consumer Discretionary,Restaurants
RCII,Rent-A-Center Inc. Common Stock,$25.31,-1.13,-4.274%,1496910494.00,United States,1995,857330,Consumer Discretionary,Diversified Commercial Services
RCKY,Rocky Brands Inc. Common Stock,$37.22,-0.06,-0.161%,272192652.00,United States,1993,20245,Consumer Discretionary,Shoe Manufacturing
RCL,D/B/A Royal Caribbean Cruises Ltd. Common Stock,$56.33,-1.42,-2.459%,14361688548.00,United States,1993,3359802,Consumer Discretionary,Hotels/Resorts
RCM,R1 RCM Inc. Common Stock,$21.74,-0.27,-1.227%,6080784069.00,United States,,765870,Consumer Discretionary,Other Consumer Services
RCMT,RCM Technologies Inc. Common Stock,$28.00,3.79,15.655%,283773364.00,United States,,737090,Consumer Discretionary,Military/Government/Technical
RDBX,Redbox Entertainment Inc. Class A Common Stock,$6.39,-0.24,-3.62%,80632317.00,United States,2020,8211947,Consumer Discretionary,Movies/Entertainment
RDBXW,Redbox Entertainment Inc. Warrant,$0.4862,-0.0238,-4.667%,0.00,United States,2020,231771,Consumer Discretionary,Movies/Entertainment
RDI,Reading International Inc Class A Common Stock,$3.61,-0.12,-3.217%,79578205.00,United States,,21622,Consumer Discretionary,Movies/Entertainment
RDIB,Reading International Inc Class B Common Stock,$23.50,1.62,7.404%,518029864.00,United States,,13195,Consumer Discretionary,Movies/Entertainment
RDWR,Radware Ltd. Ordinary Shares,$25.02,-0.29,-1.146%,1132195182.00,Israel,1999,314038,Consumer Discretionary,Business Services
REAL,The RealReal Inc. Common Stock,$2.94,-0.42,-12.50%,277457279.00,United States,2019,5826399,Consumer Discretionary,Consumer Specialties
REDU,RISE Education Cayman Ltd American Depositary Shares,$1.64,-0.01,-0.606%,97169861.00,China,2017,716914,Consumer Discretionary,Service to the Health Industry
RELX,RELX PLC PLC American Depositary Shares (Each representing One Ordinary Share),$27.76,-0.32,-1.14%,53435360857.00,United Kingdom,2015,782122,Consumer Discretionary,Publishing
RENT,Rent the Runway Inc. Class A Common Stock,$4.42,-0.07,-1.559%,283206939.00,United States,2021,621135,Consumer Discretionary,Department/Specialty Retail Stores
RETO,ReTo Eco-Solutions Inc. Common Shares,$0.707,-0.0045,-0.632%,26256645.00,China,2017,48991,Consumer Discretionary,Multi-Sector Companies
REV,Revlon Inc. New Common Stock,$4.52,0.20,4.63%,246515096.00,United States,1996,612055,Consumer Discretionary,Package Goods/Cosmetics
RGF,The Real Good Food Company Inc. Class A Common Stock,$6.15,-0.05,-0.806%,158347531.00,United States,2021,8919,Consumer Discretionary,Food Distributors
RGP,Resources Connection Inc. Common Stock,$18.63,0.14,0.757%,616742536.00,United States,,141941,Consumer Discretionary,Business Services
RH,RH Common Stock,$304.63,2.69,0.891%,7512718346.00,United States,2012,1957116,Consumer Discretionary,Other Specialty Stores
RHI,Robert Half International Inc. Common Stock,$89.99,0.06,0.067%,9945115984.00,United States,,998243,Consumer Discretionary,Diversified Commercial Services
RICK,RCI Hospitality Holdings Inc. Common Stock,$54.80,-1.89,-3.334%,516027872.00,United States,1995,112275,Consumer Discretionary,Restaurants
RIDE,Lordstown Motors Corp. Class A Common Stock,$1.83,-0.18,-8.955%,372352790.00,United States,2019,7527469,Consumer Discretionary,Construction/Ag Equipment/Trucks
RILYG,B. Riley Financial Inc. 5.00% Senior Notes due 2026,$23.49,-0.09,-0.382%,0.00,United States,,7337,Consumer Discretionary,Business Services
RILYK,B. Riley Financial Inc. 5.50% Senior Notes Due 2026,$24.90,0.16,0.647%,0.00,United States,,1735,Consumer Discretionary,Business Services
RILYM,B. Riley Financial Inc. 6.375% Senior Notes due 2025,$25.25,0.00,0.00%,0.00,United States,,6674,Consumer Discretionary,Business Services
RILYN,B. Riley Financial Inc. 6.50% Senior Notes Due 2026,$24.85,0.02,0.081%,0.00,United States,,11101,Consumer Discretionary,Business Services
RILYO,B. Riley Financial Inc. 6.75% Senior Notes due 2024,$25.25,0.00,0.00%,0.00,United States,,12976,Consumer Discretionary,Business Services
RILYT,B. Riley Financial Inc. 6.00% Senior Notes Due 2028,$24.32,-0.01,-0.041%,0.00,United States,,2798,Consumer Discretionary,Business Services
RILYZ,B. Riley Financial Inc. 5.25% Senior Notes due 2028,$23.06,0.01,0.043%,0.00,United States,,15382,Consumer Discretionary,Business Services
RIVN,Rivian Automotive Inc. Class A Common Stock,$30.19,-1.75,-5.479%,27190854725.00,United States,2021,13756048,Consumer Discretionary,Auto Manufacturing
RL,Ralph Lauren Corporation Common Stock,$105.19,1.09,1.047%,7371229327.00,United States,1997,1054707,Consumer Discretionary,Apparel
RLGT,Radiant Logistics Inc. Common Stock,$6.55,-0.15,-2.239%,323939269.00,United States,,100858,Consumer Discretionary,Oil Refining/Marketing
RLX,RLX Technology Inc. American Depositary Shares each representing the right to receive one (1) Class A ordinary share,$1.88,-0.09,-4.569%,2910037007.00,,2021,4503439,Consumer Discretionary,Farming/Seeds/Milling
RMBL,RumbleOn Inc. Class B Common Stock,$18.83,1.29,7.355%,311720651.00,United States,,262698,Consumer Discretionary,Automotive Aftermarket
RMO,Romeo Power Inc. Class A Common Stock,$0.7399,-0.0103,-1.373%,111896188.00,,2019,4876947,Consumer Discretionary,Automotive Aftermarket
ROL,Rollins Inc. Common Stock,$34.92,0.13,0.374%,17196725863.00,United States,,1258428,Consumer Discretionary,Industrial Specialties
ROST,Ross Stores Inc. Common Stock,$82.72,-0.49,-0.589%,29067174365.00,United States,1985,3059553,Consumer Discretionary,Clothing/Shoe/Accessory Stores
ROVR,Rover Group Inc. Class A Common Stock,$5.68,-0.31,-5.175%,1033413531.00,United States,2021,556110,Consumer Discretionary,Other Consumer Services
RPM,RPM International Inc. Common Stock,$87.95,-0.88,-0.991%,11389145056.00,United States,,429282,Consumer Discretionary,Paints/Coatings
RRGB,Red Robin Gourmet Burgers Inc. Common Stock,$9.82,-0.30,-2.964%,155022468.00,United States,2002,390832,Consumer Discretionary,Restaurants
RRR,Red Rock Resorts Inc. Class A Common Stock,$39.42,-0.60,-1.499%,2423226713.00,United States,2016,278261,Consumer Discretionary,Recreational Games/Products/Toys
RRX,Regal Rexnord Corporation Common Stock,$128.51,2.77,2.203%,8610733131.00,United States,1976,419495,Consumer Discretionary,Metal Fabrications
RSI,Rush Street Interactive Inc. Class A Common Stock,$5.82,-0.02,-0.342%,372176382.00,,2020,1400793,Consumer Discretionary,Services-Misc. Amusement & Recreation
RSVR,Reservoir Media Inc. Common Stock,$7.81,0.05,0.644%,500922771.00,United States,2021,80482,Consumer Discretionary,Movies/Entertainment
RSVRW,Reservoir Media Inc. Warrant,$1.76,-0.06,-3.297%,0.00,United States,2021,4647,Consumer Discretionary,Movies/Entertainment
RUSHA,Rush Enterprises Inc. Common Stock Cl A,$52.15,-0.50,-0.95%,2886706198.00,United States,,115284,Consumer Discretionary,Other Specialty Stores
RUSHB,Rush Enterprises Inc. Class B,$51.06,-0.71,-1.371%,2826370440.00,United States,,25682,Consumer Discretionary,Other Specialty Stores
RUTH,Ruth's Hospitality Group Inc. Common Stock,$18.95,-0.07,-0.368%,650413043.00,United States,2005,311292,Consumer Discretionary,Restaurants
RVLV,Revolve Group Inc. Class A Common Stock,$31.14,0.11,0.354%,2282816320.00,,2019,1052288,Consumer Discretionary,Catalog/Specialty Distribution
RVMD,Revolution Medicines Inc. Common Stock,$19.13,1.83,10.578%,1420309509.00,United States,2020,720932,Consumer Discretionary,Specialty Chemicals
RYAAY,Ryanair Holdings plc American Depositary Shares,$85.45,-1.79,-2.052%,19390630592.00,Ireland,1997,138429,Consumer Discretionary,Air Freight/Delivery Services
SABR,Sabre Corporation Common Stock,$7.61,-0.22,-2.81%,2483832534.00,United States,2014,4991744,Consumer Discretionary,Other Consumer Services
SABRP,Sabre Corporation 6.50% Series A Mandatory Convertible Preferred Stock,$99.95,-1.8837,-1.85%,0.00,United States,,3142,Consumer Discretionary,Other Consumer Services
SAH,Sonic Automotive Inc. Common Stock,$45.30,-0.24,-0.527%,1792052507.00,United States,1997,266175,Consumer Discretionary,Other Specialty Stores
SALM,Salem Media Group Inc. Class A Common Stock,$2.85,-0.01,-0.35%,77562143.00,United States,1999,40893,Consumer Discretionary,Broadcasting
SANA,Sana Biotechnology Inc. Common Stock,$5.59,0.16,2.947%,1060243718.00,United States,2021,1697397,Consumer Discretionary,Specialty Chemicals
SAVE,Spirit Airlines Inc. Common Stock,$20.74,-0.37,-1.753%,2252751900.00,United States,,2853757,Consumer Discretionary,Air Freight/Delivery Services
