Symbol,Name,Last Sale,Net Change,% Change,Market Cap,Country,IPO Year,Volume,Sector,Industry
AACG,ATA Creativity Global American Depositary Shares,$1.02,-0.01,-0.971%,32230560.00,China,2008,9154,Consumer Discretionary,Service to the Health Industry
AAL,American Airlines Group Inc. Common Stock,$16.22,-1.24,-7.102%,10535130835.00,United States,,46267565,Consumer Discretionary,Air Freight/Delivery Services
AAP,Advance Auto Parts Inc.,$190.73,-0.36,-0.188%,11565833822.00,United States,,462858,Consumer Discretionary,Auto & Home Supply Stores
AAWW,Atlas Air Worldwide Holdings NEW Common Stock,$70.18,-0.72,-1.016%,1978400798.00,United States,,312839,Consumer Discretionary,Transportation Services
ABG,Asbury Automotive Group Inc Common Stock,$182.72,0.80,0.44%,4043831136.00,United States,2002,182477,Consumer Discretionary,Other Specialty Stores
ABM,ABM Industries Incorporated Common Stock,$49.62,0.62,1.265%,3318042608.00,United States,,316167,Consumer Discretionary,Diversified Commercial Services
ABNB,Airbnb Inc. Class A Common Stock,$119.83,-1.43,-1.179%,71466493009.00,United States,2020,4584611,Consumer Discretionary,Hotels/Resorts
ACBA,Ace Global Business Acquisition Limited Ordinary Shares,$10.27,0.00,0.00%,62174580.00,Hong Kong,2021,11,Consumer Discretionary,Business Services
ACCO,Acco Brands Corporation Common Stock,$7.24,0.01,0.138%,702180645.00,United States,,501219,Consumer Discretionary,Advertising
ACEL,Accel Entertainment Inc. ,$10.93,-0.09,-0.817%,1011753211.00,United States,2017,260854,Consumer Discretionary,Recreational Games/Products/Toys
ACM,AECOM Common Stock,$70.34,-0.35,-0.495%,9920646543.00,United States,2007,483785,Consumer Discretionary,Military/Government/Technical
ACN,Accenture plc Class A Ordinary Shares (Ireland),$304.95,-1.67,-0.545%,193155554443.00,Ireland,2001,1714525,Consumer Discretionary,Business Services
ACRX,AcelRx Pharmaceuticals Inc. Common Stock,$0.23,-0.0129,-5.311%,33836221.00,United States,2011,2287790,Consumer Discretionary,Specialty Chemicals
ACU,Acme United Corporation. Common Stock,$33.34,0.84,2.585%,117378338.00,United States,1988,15786,Consumer Discretionary,Home Furnishings
ADNT,Adient plc Ordinary Shares ,$36.24,-1.54,-4.076%,3435964339.00,,2016,456745,Consumer Discretionary,Auto Parts:O.E.M.
ADP,Automatic Data Processing Inc. Common Stock,$220.68,-3.03,-1.354%,92188441503.00,United States,,1445091,Consumer Discretionary,Business Services
ADT,ADT Inc. Common Stock,$7.46,-0.08,-1.061%,6761130430.00,United States,2018,1197684,Consumer Discretionary,Diversified Commercial Services
ADTH,AdTheorent Holding Company Inc. Common Stock,$8.21,-0.90,-9.879%,703958191.00,United States,2021,163661,Consumer Discretionary,Advertising
ADTHW,AdTheorent Holding Company Inc. Warrants,$0.9583,-0.3417,-26.285%,0.00,United States,2021,8839,Consumer Discretionary,Advertising
ADTX,Aditxt Inc. Common Stock,$0.295,0.0049,1.689%,13194122.00,United States,2020,258396,Consumer Discretionary,Specialty Chemicals
ADV,Advantage Solutions Inc. Class A Common Stock,$4.45,-0.06,-1.33%,1416919752.00,United States,2019,364746,Consumer Discretionary,Advertising
ADVWW,Advantage Solutions Inc. Warrant,$0.408,0.00,0.00%,0.00,United States,2019,43,Consumer Discretionary,Advertising
AEHL,Antelope Enterprise Holdings Limited Common Stock (0.024 par),$0.7996,0.0395,5.197%,4822871.00,China,,17172,Consumer Discretionary,Building Products
AEIS,Advanced Energy Industries Inc. Common Stock,$80.77,-1.62,-1.966%,3033666196.00,United States,1995,95289,Consumer Discretionary,Electrical Products
AEO,American Eagle Outfitters Inc. Common Stock,$12.79,0.81,6.761%,2166651900.00,United States,,12877999,Consumer Discretionary,Clothing/Shoe/Accessory Stores
AER,AerCap Holdings N.V. Ordinary Shares,$49.21,-0.37,-0.746%,12086904691.00,Netherlands,2006,537484,Consumer Discretionary,Diversified Commercial Services
AEVA,Aeva Technologies Inc. Common Stock,$2.99,-0.10,-3.236%,647942027.00,,2020,645128,Consumer Discretionary,Auto Parts:O.E.M.
AEY,ADDvantage Technologies Group Inc. Common Stock,$1.3999,0.0017,0.122%,18506478.00,United States,,6351,Consumer Discretionary,Durable Goods
AGFY,Agrify Corporation Common Stock,$2.48,-0.03,-1.195%,65946766.00,United States,2021,90633,Consumer Discretionary,Military/Government/Technical
AGS,PlayAGS Inc. Common Stock,$6.00,-0.05,-0.826%,222643152.00,United States,2018,147608,Consumer Discretionary,Recreational Games/Products/Toys
AIKI,AIkido Pharma Inc. Common Stock,$0.2964,-0.0046,-1.528%,26466577.00,United States,,1914002,Consumer Discretionary,Specialty Chemicals
AIN,Albany International Corporation Common Stock,$84.40,-1.30,-1.517%,2658600000.00,United States,,80221,Consumer Discretionary,Textiles
AIRT,Air T Inc. Common Stock,$17.30,0.49,2.915%,49771287.00,United States,,9248,Consumer Discretionary,Air Freight/Delivery Services
AIRTP,Air T Inc. Air T Funding Alpha Income Trust Preferred Securities,$22.48,-0.02,-0.089%,0.00,United States,,557,Consumer Discretionary,Air Freight/Delivery Services
AIU,Meta Data Limited ADS,$1.73,0.13,8.125%,25278170.00,,2018,32857,Consumer Discretionary,Service to the Health Industry
AKA,a.k.a. Brands Holding Corp. Common Stock,$4.03,-0.02,-0.494%,518479388.00,,2021,86275,Consumer Discretionary,Department/Specialty Retail Stores
AKAM,Akamai Technologies Inc. Common Stock,$100.84,-1.90,-1.849%,16165175662.00,United States,1999,1005165,Consumer Discretionary,Business Services
AKUS,Akouos Inc. Common Stock,$3.20,0.05,1.587%,110803699.00,United States,2020,93426,Consumer Discretionary,Specialty Chemicals
AL,Air Lease Corporation Class A Common Stock,$37.53,-0.98,-2.545%,4160513913.00,United States,2011,360985,Consumer Discretionary,Diversified Commercial Services
ALGT,Allegiant Travel Company Common Stock,$146.31,-1.69,-1.142%,2650732068.00,United States,2006,195940,Consumer Discretionary,Air Freight/Delivery Services
ALJJ,ALJ Regional Holdings Inc. Common Stock,$2.015,-0.005,-0.248%,85453792.00,United States,,261471,Consumer Discretionary,Business Services
ALK,Alaska Air Group Inc. Common Stock,$48.88,1.49,3.144%,6163368357.00,United States,,3661538,Consumer Discretionary,Air Freight/Delivery Services
ALLE,Allegion plc Ordinary Shares,$111.44,-2.67,-2.34%,9784980285.00,United States,2013,1287048,Consumer Discretionary,Diversified Commercial Services
ALSN,Allison Transmission Holdings Inc. Common Stock,$40.99,0.32,0.787%,3978679840.00,United States,2012,697551,Consumer Discretionary,Auto Parts:O.E.M.
ALTG,Alta Equipment Group Inc. Class A Common Stock,$11.14,-0.20,-1.764%,361537839.00,,2019,49311,Consumer Discretionary,Engineering & Construction
ALV,Autoliv Inc. Common Stock,$79.00,-3.31,-4.021%,6900184532.00,Sweden,,872113,Consumer Discretionary,Auto Parts:O.E.M.
ALZN,Alzamend Neuro Inc. Common Stock,$0.975,0.0205,2.148%,90693808.00,United States,2021,280868,Consumer Discretionary,Specialty Chemicals
AMBO,Ambow Education Holding Ltd. American Depository Shares each representing two Class A ordinary shares,$0.60,0.0099,1.678%,14031930.00,China,,89640,Consumer Discretionary,Service to the Health Industry
AMC,AMC Entertainment Holdings Inc. Class A Common Stock,$12.45,-0.85,-6.391%,6434416408.00,,2013,39226048,Consumer Discretionary,Movies/Entertainment
AMCR,Amcor plc Ordinary Shares,$13.39,-0.06,-0.446%,20122046153.00,,2019,7248249,Consumer Discretionary,Miscellaneous manufacturing industries
AMCX,AMC Networks Inc. Class A Common Stock,$36.44,-1.65,-4.332%,1563963222.00,United States,,218668,Consumer Discretionary,Movies/Entertainment
AME,AMETEK Inc.,$122.41,-0.80,-0.649%,28265694202.00,United States,,1660137,Consumer Discretionary,Metal Fabrications
AMTI,Applied Molecular Transport Inc. Common Stock,$3.38,0.23,7.302%,130651071.00,United States,2020,197005,Consumer Discretionary,Specialty Chemicals
AMWD,American Woodmark Corporation Common Stock,$53.73,1.33,2.538%,890339359.00,United States,1986,113535,Consumer Discretionary,Building Products
AMZN,Amazon.com Inc. Common Stock,$2447.00,-63.22,-2.519%,497935606802800.00,United States,1997,4880166,Consumer Discretionary,Catalog/Specialty Distribution
AN,AutoNation Inc. Common Stock,$121.20,0.40,0.331%,7068948428.00,United States,,565625,Consumer Discretionary,Other Specialty Stores
ANF,Abercrombie & Fitch Company Common Stock,$20.36,-0.05,-0.245%,1026999120.00,United States,,1949607,Consumer Discretionary,Clothing/Shoe/Accessory Stores
ANGH,Anghami Inc. Ordinary Shares,$6.25,-0.6099,-8.891%,162535338.00,United Arab Emirates,,3756,Consumer Discretionary,Movies/Entertainment
ANGHW,Anghami Inc. Warrants,$0.3301,-0.0399,-10.784%,0.00,United Arab Emirates,,819,Consumer Discretionary,Movies/Entertainment
ANTE,AirNet Technology Inc. American Depositary Shares,$1.27,0.035,2.834%,45332312.00,China,2007,6558,Consumer Discretionary,Advertising
ANVS,Annovis Bio Inc. Common Stock,$10.11,0.27,2.744%,82537262.00,United States,2020,20510,Consumer Discretionary,Specialty Chemicals
APEI,American Public Education Inc. Common Stock,$14.13,-0.15,-1.05%,266440254.00,United States,2007,42460,Consumer Discretionary,Other Consumer Services
APG,APi Group Corporation Common Stock,$17.77,-0.28,-1.551%,4143761635.00,,2020,661137,Consumer Discretionary,Military/Government/Technical
APRN,Blue Apron Holdings Inc. Class A Common Stock,$3.10,-0.30,-8.824%,106543699.00,United States,2017,2019926,Consumer Discretionary,Catalog/Specialty Distribution
APTV,Aptiv PLC Ordinary Shares,$106.28,-4.61,-4.157%,28794538709.00,United Kingdom,2011,1253265,Consumer Discretionary,Auto Parts:O.E.M.
ARC,ARC Document Solutions Inc. Common Stock,$3.01,0.09,3.082%,130256471.00,United States,2004,133156,Consumer Discretionary,Business Services
ARCE,Arco Platform Limited Class A Common Shares,$16.75,-0.06,-0.357%,952260933.00,Brazil,2018,126313,Consumer Discretionary,Service to the Health Industry
ARCO,Arcos Dorados Holdings Inc. Class A Shares,$7.71,-0.19,-2.405%,1622787863.00,Argentina,2011,951386,Consumer Discretionary,Restaurants
AREB,American Rebel Holdings Inc. Common Stock,$0.739,-0.0004,-0.054%,3373718.00,United States,,104677,Consumer Discretionary,Apparel
AREBW,American Rebel Holdings Inc. Warrants,$0.1086,0.00,0.00%,0.00,United States,,31,Consumer Discretionary,Apparel
ARHS,Arhaus Inc. Class A Common Stock,$5.88,-0.11,-1.836%,823571716.00,United States,2021,325869,Consumer Discretionary,Wholesale Distributors
ARKR,Ark Restaurants Corp. Common Stock,$18.21,-0.44,-2.359%,64688184.00,United States,,4355,Consumer Discretionary,Restaurants
ARNC,Arconic Corporation Common Stock ,$28.37,-0.64,-2.206%,3001104137.00,,2020,686590,Consumer Discretionary,Aerospace
ARVL,Arrival Ordinary Shares,$1.73,-0.07,-3.889%,1104221236.00,Luxembourg,,2974213,Consumer Discretionary,Auto Manufacturing
ASC,Ardmore Shipping Corporation Common Stock,$7.76,0.14,1.837%,268290570.00,,2013,691374,Consumer Discretionary,Marine Transportation
ASLE,AerSale Corporation Common Stock,$14.33,-0.06,-0.417%,740689857.00,United States,2019,56237,Consumer Discretionary,Aerospace
ASO,Academy Sports and Outdoors Inc. Common Stock,$34.73,-1.02,-2.853%,2968862515.00,United States,2020,2341644,Consumer Discretionary,Recreational Games/Products/Toys
ASPU,Aspen Group Inc. Common Stock,$1.17,0.00,0.00%,29486665.00,United States,,15560,Consumer Discretionary,Other Consumer Services
ASR,Grupo Aeroportuario del Sureste S.A. de C.V. Common Stock,$218.85,-2.14,-0.968%,6565500000.00,Mexico,,68647,Consumer Discretionary,Aerospace
ASTS,AST SpaceMobile Inc. Class A Common Stock,$8.48,-0.26,-2.975%,439798011.00,United States,2019,319337,Consumer Discretionary,Telecommunications Equipment
ASTSW,AST SpaceMobile Inc. Warrant,$2.82,-0.0766,-2.644%,0.00,United States,2019,15995,Consumer Discretionary,Telecommunications Equipment
ATCO,Atlas Corp. Common Shares,$13.27,-0.02,-0.15%,3342389477.00,United Kingdom,,304348,Consumer Discretionary,Marine Transportation
ATCX,Atlas Technical Consultants Inc. Class A Common Stock,$7.86,-0.13,-1.627%,276010911.00,United States,2019,56435,Consumer Discretionary,Military/Government/Technical
ATEX,Anterix Inc. Common Stock,$43.56,-1.14,-2.55%,824764430.00,United States,2015,62245,Consumer Discretionary,Telecommunications Equipment
ATGE,Adtalem Global Education Inc. Common Stock,$34.09,0.48,1.428%,1538942938.00,United States,,559505,Consumer Discretionary,Other Consumer Services
ATHA,Athira Pharma Inc. Common Stock,$9.17,-0.11,-1.185%,345121964.00,United States,2020,374675,Consumer Discretionary,Specialty Chemicals
ATIF,ATIF Holdings Limited Ordinary Shares,$2.22,-0.38,-14.615%,20338286.00,China,2019,398,Consumer Discretionary,Professional Services
ATSG,Air Transport Services Group Inc,$31.16,-0.10,-0.32%,2317432704.00,United States,,378601,Consumer Discretionary,Air Freight/Delivery Services
ATVI,Activision Blizzard Inc. Common Stock,$77.89,-0.34,-0.435%,60900747854.00,United States,,2639743,Consumer Discretionary,Recreational Games/Products/Toys
ATXI,Avenue Therapeutics Inc. Common Stock,$0.29,0.0195,7.209%,6419087.00,United States,2017,61991,Consumer Discretionary,Specialty Chemicals
AUD,Audacy Common Stock,$1.66,-0.06,-3.488%,238241726.00,United States,,604766,Consumer Discretionary,Broadcasting
AUTO,AutoWeb Inc. Common Stock,$0.505,-0.0056,-1.097%,7095830.00,United States,,73877,Consumer Discretionary,Business Services
AVIR,Atea Pharmaceuticals Inc. Common Stock,$7.80,-0.07,-0.889%,649409210.00,United States,2020,545236,Consumer Discretionary,Specialty Chemicals
AXL,American Axle & Manufacturing Holdings Inc. Common Stock,$8.74,-0.16,-1.798%,1000611888.00,United States,,1450433,Consumer Discretionary,Auto Parts:O.E.M.
AXON,Axon Enterprise Inc. Common Stock,$103.09,-2.02,-1.922%,7320570484.00,United States,2001,344426,Consumer Discretionary,Military/Government/Technical
AXTA,Axalta Coating Systems Ltd. Common Shares,$27.20,-0.57,-2.053%,6023918802.00,United States,2014,2695708,Consumer Discretionary,Paints/Coatings
AYI,Acuity Brands Inc. ,$180.14,1.30,0.727%,6229319020.00,United States,,131307,Consumer Discretionary,Building Products
AYLA,Ayala Pharmaceuticals Inc. Common Stock,$1.72,0.05,2.994%,24226687.00,Israel,2020,14164,Consumer Discretionary,Specialty Chemicals
AZUL,Azul S.A. American Depositary Shares (each representing three preferred shares),$11.52,-0.42,-3.518%,1334762980.00,Brazil,2017,1266314,Consumer Discretionary,Air Freight/Delivery Services
BABA,Alibaba Group Holding Limited American Depositary Shares each representing eight Ordinary share,$93.21,-4.29,-4.40%,249336750000.00,China,2014,15855929,Consumer Discretionary,Business Services
BAH,Booz Allen Hamilton Holding Corporation Common Stock,$87.21,-0.26,-0.297%,11527917949.00,United States,2010,1015119,Consumer Discretionary,Professional Services
BALY,Bally's Corporation Common Stock,$27.59,-0.16,-0.577%,1449536553.00,,2019,175189,Consumer Discretionary,Recreational Games/Products/Toys
BAM,Brookfield Asset Management Inc. Common Stock,$50.24,-1.13,-2.20%,82468073766.00,Canada,1925,1422669,Consumer Discretionary,Other Consumer Services
BAOS,Baosheng Media Group Holdings Limited Ordinary shares,$1.34,0.0199,1.507%,12252953.00,China,2021,174827,Consumer Discretionary,Business Services
BARK,BARK Inc. Class A Common Stock,$1.86,-0.14,-7.00%,326074424.00,,2020,6430649,Consumer Discretionary,Department/Specialty Retail Stores
BATRA,Liberty Media Corporation Series A Liberty Braves Common Stock,$26.45,0.45,1.731%,1398086509.00,United States,,38656,Consumer Discretionary,Movies/Entertainment
BATRK,Liberty Media Corporation Series C Liberty Braves Common Stock,$25.67,0.45,1.784%,1356857493.00,United States,,81846,Consumer Discretionary,Movies/Entertainment
BBBY,Bed Bath & Beyond Inc. Common Stock,$8.10,-0.33,-3.915%,647080180.00,United States,1992,4382652,Consumer Discretionary,Other Specialty Stores
BBCP,Concrete Pumping Holdings Inc. Common Stock,$5.43,0.06,1.117%,308101002.00,United States,2017,45285,Consumer Discretionary,Military/Government/Technical
BBGI,Beasley Broadcast Group Inc. Class A Common Stock,$1.47,-0.06,-3.922%,43208830.00,United States,2000,41905,Consumer Discretionary,Broadcasting
BBIG,Vinco Ventures Inc. Common Stock,$2.06,-0.11,-5.069%,480270446.00,United States,2018,10988335,Consumer Discretionary,Recreational Games/Products/Toys
BBIGV,Vinco Ventures Inc. Ex-Distribution When-Issued,$1.30,-0.12,-8.451%,0.00,United States,,3667,Consumer Discretionary,Recreational Games/Products/Toys
BBQ,BBQ Holdings Inc. Common Stock,$12.32,-0.29,-2.30%,132511468.00,United States,,18316,Consumer Discretionary,Restaurants
BBSI,Barrett Business Services Inc. Common Stock,$74.11,-1.06,-1.41%,542496465.00,United States,1993,39220,Consumer Discretionary,Professional Services
BBU,Brookfield Business Partners L.P. Limited Partnership Units ,$23.12,-0.82,-3.425%,1750990772.00,,2016,48774,Consumer Discretionary,Building Products
BBW,Build-A-Bear Workshop Inc. Common Stock,$19.44,-0.80,-3.953%,307167571.00,United States,2004,228176,Consumer Discretionary,Recreational Games/Products/Toys
BBY,Best Buy Co. Inc. Common Stock,$80.39,-0.87,-1.071%,18101288239.00,United States,,2295953,Consumer Discretionary,Consumer Electronics/Video Chains
BC,Brunswick Corporation Common Stock,$71.94,-2.52,-3.384%,5448010229.00,United States,,754425,Consumer Discretionary,Homebuilding
BCAB,BioAtla Inc. Common Stock,$2.75,0.33,13.636%,102888291.00,United States,2020,426008,Consumer Discretionary,Specialty Chemicals
BDL,Flanigan's Enterprises Inc. Common Stock,$35.9192,-0.5808,-1.591%,66761113.00,United States,1972,5700,Consumer Discretionary,Restaurants
BE,Bloom Energy Corporation Class A Common Stock,$18.22,-0.32,-1.726%,3246786545.00,,2018,1733346,Consumer Discretionary,Electrical Products
BEAM,Beam Therapeutics Inc. Common Stock,$37.28,0.43,1.167%,2619544850.00,United States,2020,904756,Consumer Discretionary,Specialty Chemicals
BECN,Beacon Roofing Supply Inc. Common Stock,$62.95,-0.07,-0.111%,4327289323.00,United States,2004,394796,Consumer Discretionary,Wholesale Distributors
BEDU,Bright Scholar Education Holdings Limited American Depositary Shares each  representing one Class A Ordinary Share,$0.78,0.005,0.645%,92969897.00,China,2017,19227,Consumer Discretionary,Other Consumer Services
BFAM,Bright Horizons Family Solutions Inc. Common Stock,$88.68,-1.79,-1.979%,5267874889.00,United States,2013,267667,Consumer Discretionary,Other Consumer Services
BFI,BurgerFi International Inc. Common Stock ,$3.35,-0.04,-1.18%,74489605.00,Mexico,2018,48215,Consumer Discretionary,Restaurants
BFIIW,BurgerFi International Inc. Warrant ,$0.4367,0.0067,1.558%,0.00,Mexico,2018,20528,Consumer Discretionary,Restaurants
BGFV,Big 5 Sporting Goods Corporation Common Stock,$12.20,-0.79,-6.082%,272386826.00,United States,2002,504391,Consumer Discretionary,Other Specialty Stores
BGSF,BGSF Inc. Common Stock,$12.39,-0.06,-0.482%,129701828.00,United States,,19206,Consumer Discretionary,Diversified Commercial Services
BH,Biglari Holdings Inc. Class B Common Stock,$134.49,-1.07,-0.789%,417317090.00,United States,2018,10733,Consumer Discretionary,Restaurants
BHAT,Blue Hat Interactive Entertainment Technology Ordinary Shares,$1.47,0.02,1.379%,51657438.00,China,2019,12411,Consumer Discretionary,Recreational Games/Products/Toys
BIG,Big Lots Inc. Common Stock,$23.91,0.14,0.589%,682810590.00,United States,,1514468,Consumer Discretionary,Department/Specialty Retail Stores
BIOR,Biora Therapeutics Inc. Common Stock,$0.80,-0.0033,-0.411%,147359143.00,United States,2020,1556143,Consumer Discretionary,Specialty Chemicals
BIRD,Allbirds Inc. Class A Common Stock,$5.86,0.05,0.861%,869917539.00,United States,2021,1411868,Consumer Discretionary,Shoe Manufacturing
BJ,BJ's Wholesale Club Holdings Inc. Common Stock,$59.79,0.22,0.369%,8082522094.00,United States,2018,1173129,Consumer Discretionary,Department/Specialty Retail Stores
BJRI,BJ's Restaurants Inc. Common Stock,$26.38,-0.67,-2.477%,618320583.00,United States,,132683,Consumer Discretionary,Restaurants
BKE,Buckle Inc. (The) Common Stock,$32.31,0.16,0.498%,1618564636.00,United States,,379941,Consumer Discretionary,Clothing/Shoe/Accessory Stores
BKNG,Booking Holdings Inc. Common Stock,$2335.87,-36.49,-1.538%,94890644993.00,United States,,308670,Consumer Discretionary,Other Consumer Services
BLBD,Blue Bird Corporation Common Stock,$12.26,-0.29,-2.311%,392207944.00,United States,2014,39558,Consumer Discretionary,Construction/Ag Equipment/Trucks
BLDE,Blade Air Mobility Inc. Class A Common Stock,$6.97,-0.37,-5.041%,495876893.00,United States,2019,420941,Consumer Discretionary,Aerospace
BLDEW,Blade Air Mobility Inc. Warrants,$1.35,-0.15,-10.00%,0.00,United States,2019,4918,Consumer Discretionary,Aerospace
BLDR,Builders FirstSource Inc. Common Stock,$65.80,-0.07,-0.106%,11367851394.00,United States,2005,1745332,Consumer Discretionary,RETAIL: Building Materials
BLI,Berkeley Lights Inc. Common Stock,$4.57,-0.45,-8.964%,309967397.00,United States,2020,1025476,Consumer Discretionary,Specialty Chemicals
BLMN,Bloomin' Brands Inc. Common Stock,$20.92,-0.36,-1.692%,1855664019.00,United States,2012,2180478,Consumer Discretionary,Restaurants
BNED,Barnes & Noble Education Inc Common Stock,$2.77,0.07,2.593%,144167284.00,United States,2015,560307,Consumer Discretionary,Other Specialty Stores
BOC,Boston Omaha Corporation Class A Common Stock,$21.26,-0.61,-2.789%,631387155.00,United States,,67506,Consumer Discretionary,Advertising
BOOT,Boot Barn Holdings Inc. Common Stock,$85.12,0.48,0.567%,2531234805.00,United States,2014,338157,Consumer Discretionary,Clothing/Shoe/Accessory Stores
BOWL,Bowlero Corp. Class A Common Stock,$10.99,0.04,0.365%,1883242334.00,,2021,519382,Consumer Discretionary,Movies/Entertainment
BQ,Boqii Holding Limited American Depositary Shares representing Class A Ordinary Shares,$2.1704,0.2143,10.955%,33154757.00,,2020,2547954,Consumer Discretionary,Other Specialty Stores
BR,Broadridge Financial Solutions Inc. Common Stock,$146.29,-1.34,-0.908%,17149113253.00,United States,,255695,Consumer Discretionary,Business Services
BRDS,Bird Global Inc. Class A Common Stock,$0.7494,-0.0284,-3.651%,208912501.00,,2021,1494206,Consumer Discretionary,Diversified Commercial Services
BRLT,Brilliant Earth Group Inc. Class A Common Stock,$4.80,0.03,0.629%,454391914.00,United States,2021,327358,Consumer Discretionary,Consumer Specialties
BROS,Dutch Bros Inc. Class A Common Stock,$41.71,1.73,4.327%,2236437061.00,,2021,1027483,Consumer Discretionary,Restaurants
BSET,Bassett Furniture Industries Incorporated Common Stock,$16.81,0.21,1.265%,162383457.00,United States,,90318,Consumer Discretionary,Home Furnishings
BTBD,BT Brands Inc. Common Stock,$2.2901,-0.1799,-7.283%,14796606.00,United States,2021,6762,Consumer Discretionary,Restaurants
BTBDW,BT Brands Inc. Warrant,$0.2243,-0.1096,-32.824%,0.00,United States,2021,7902,Consumer Discretionary,Restaurants
BTI,British American Tobacco  Industries p.l.c. Common Stock ADR,$44.14,-0.52,-1.164%,100097791693.00,United Kingdom,1998,1928071,Consumer Discretionary,Farming/Seeds/Milling
BTN,Ballantyne Strong Inc. Common Stock,$2.9204,0.0017,0.058%,56224519.00,United States,,53866,Consumer Discretionary,Industrial Machinery/Components
BTTR,Better Choice Company Inc. Common Stock,$2.67,0.18,7.229%,78403781.00,,2021,32822,Consumer Discretionary,Food Distributors
BURL,Burlington Stores Inc. Common Stock,$170.87,-3.28,-1.883%,11289733747.00,,2013,790947,Consumer Discretionary,Apparel
BV,BrightView Holdings Inc. Common Stock,$13.07,-0.10,-0.759%,1215510000.00,United States,2018,164463,Consumer Discretionary,Business Services
BVH,Bluegreen Vacations Holding Corporation Class A Common Stock,$28.61,-0.09,-0.314%,577395347.00,United States,2017,62626,Consumer Discretionary,Hotels/Resorts
BWA,BorgWarner Inc. Common Stock,$39.30,-0.93,-2.312%,9415292077.00,United States,,1315003,Consumer Discretionary,Auto Parts:O.E.M.
BWMN,Bowman Consulting Group Ltd. Common Stock,$15.06,-0.07,-0.463%,199078878.00,United States,2021,11227,Consumer Discretionary,Professional Services
BWMX,Betterware de Mexico S.A.B. de C.V. Ordinary Shares,$13.26,-0.20,-1.486%,494817400.00,Mexico,,25325,Consumer Discretionary,Catalog/Specialty Distribution
BXC,Bluelinx Holdings Inc. Common Stock,$87.29,2.20,2.585%,843043154.00,United States,2004,140697,Consumer Discretionary,Wholesale Distributors
BYD,Boyd Gaming Corporation Common Stock,$59.39,-0.53,-0.885%,6508176537.00,United States,1993,881813,Consumer Discretionary,Movies/Entertainment
BYRN,Byrna Technologies Inc. Common Stock,$8.00,-0.01,-0.125%,183322304.00,United States,,116020,Consumer Discretionary,Military/Government/Technical
BZFD,BuzzFeed Inc. Class A Common Stock,$3.76,0.22,6.215%,509331871.00,United States,2021,260428,Consumer Discretionary,Movies/Entertainment
BZFDW,BuzzFeed Inc. Warrant,$0.40,0.06,17.647%,0.00,United States,2021,6839,Consumer Discretionary,Movies/Entertainment
BZH,Beazer Homes USA Inc. Common Stock,$16.44,-0.03,-0.182%,517163388.00,United States,1994,350446,Consumer Discretionary,Homebuilding
BZUN,Baozun Inc. American Depositary Shares,$9.63,0.02,0.208%,651044153.00,China,2015,1061749,Consumer Discretionary,Catalog/Specialty Distribution
CAAP,Corporacion America Airports SA Common Shares,$6.29,-0.01,-0.159%,1026670827.00,,2018,51294,Consumer Discretionary,Aerospace
CAAS,China Automotive Systems Inc. Common Stock,$2.91,0.01,0.345%,89778668.00,China,,14494,Consumer Discretionary,Auto Parts:O.E.M.
CABO,Cable One Inc. Common Stock,$1288.59,0.24,0.019%,7722244112.00,United States,2015,29115,Consumer Discretionary,Telecommunications Equipment
CAJ,Canon Inc. American Depositary Shares,$25.22,-0.34,-1.33%,26374439094.00,Japan,,315905,Consumer Discretionary,Industrial Machinery/Components
